domain	utterance	intents
reminder	Display all monthly reminders for tuition fee payment for 2018	[IN:GET_REMINDER, IN:GET_RECURRING_DATE_TIME, IN:GET_TODO]
reminder	I want to see all our reminders for next week.	[IN:GET_REMINDER]
reminder	Delete my first reminder for today.	[IN:DELETE_REMINDER]
reminder	Remind me to set up a lunch meeting with Ophelia on August 15 before she moves to Conway.	[IN:CREATE_REMINDER, IN:GET_TODO]
reminder	Show my reminders  for saturday?	[IN:GET_REMINDER]
reminder	I have a date night schedule with Jill at 8 pm and she just called and asked to change that to 9 pm so please adjustment my reminder.	[IN:UPDATE_REMINDER_DATE_TIME]
reminder	Could you change next weekend reminder to eat time	[IN:UPDATE_REMINDER_TODO]
reminder	Change the reminder for Kayak's med to every other day at 5.	[IN:UPDATE_REMINDER, IN:GET_RECURRING_DATE_TIME]
reminder	Show me all the reminders for next month	[IN:GET_REMINDER]
reminder	Change the reminder for my dogs vet appointment from September 9 to September 19	[IN:UPDATE_REMINDER_DATE_TIME]
reminder	When is my reminder for my Anniversary dinner with Aaron?	[IN:GET_REMINDER_DATE_TIME, IN:GET_TODO]
reminder	Please show me reminders for my breakfast dates this week	[IN:GET_REMINDER]
reminder	pull up pta reminders for fall	[IN:GET_REMINDER]
reminder	Change the meeting time reminder from 2 PM to 4 PM.	[IN:UPDATE_REMINDER_DATE_TIME]
reminder	Move my reminder about Trish's birthday to Thursday.	[IN:UPDATE_REMINDER_DATE_TIME]
reminder	Set up a reminder to message Mom about school details tonight at 7 PM.	[IN:CREATE_REMINDER, IN:SEND_MESSAGE, IN:GET_CONTACT]
reminder	move the reminder about bree's birthday from friday to thursday	[IN:UPDATE_REMINDER_DATE_TIME]
reminder	Change my reminder to buy baby food from tomorrow at noon to today at 3	[IN:UPDATE_REMINDER_DATE_TIME]
reminder	Remind me to send an email to all IT group members that the team building excursion will be canceled due to bad weather at 2:00 pm.	[IN:CREATE_REMINDER, IN:SEND_MESSAGE]
reminder	I reminder to visit my daughter for dinner on Tuesday change it to Thursday	[IN:UPDATE_REMINDER_DATE_TIME]
reminder	Move my reminder for the concert for Wednesday to Thursday at 8pm	[IN:UPDATE_REMINDER_DATE_TIME]
reminder	Tell me reminders about mom and dad.	[IN:GET_REMINDER]
reminder	Show me the reminder for Kelly's birthday party.	[IN:GET_REMINDER]
reminder	show me the location of chris' football game reminder	[IN:GET_REMINDER_LOCATION]
reminder	show my reminder twice	[IN:GET_REMINDER]
reminder	When is the reminder set for Traico's birthday party?	[IN:GET_REMINDER_DATE_TIME]
reminder	How many reminders do I have for work the rest of the month?	[IN:GET_REMINDER_AMOUNT]
reminder	Please cancel the reminder for Lunch with Evan today.	[IN:DELETE_REMINDER, IN:GET_TODO]
reminder	Can you tell me my reminders for Saturday?	[IN:GET_REMINDER]
reminder	Instead of Monday, change the date of the reminder for Wednesday.	[IN:UPDATE_REMINDER_DATE_TIME]
reminder	When did I set a reminder for Dog sitting	[IN:GET_REMINDER_DATE_TIME]
reminder	I need to move my car maintenance reminder to Tuesday at 9am.	[IN:UPDATE_REMINDER_DATE_TIME]
reminder	Change the alert for mom's birthday from one week ahead to two weeks ahead.	[IN:UPDATE_REMINDER_DATE_TIME]
reminder	Remind me to workout with Jo tomorrow at 6am.	[IN:CREATE_REMINDER, IN:GET_TODO]
reminder	Can you please remind me to send my uncle a gift card with Carlos?	[IN:CREATE_REMINDER, IN:GET_TODO]
reminder	Alert me 15 minutes before dinner with Smiths	[IN:CREATE_REMINDER, IN:GET_TODO]
reminder	Remind me to meet with Jenny tomorrow at 8am	[IN:CREATE_REMINDER, IN:GET_TODO]
reminder	Remind me to email Zack about the new podcast tomorrow	[IN:CREATE_REMINDER, IN:SEND_MESSAGE]
reminder	Can you remind my sister to send out a birthday card to Grandma by Friday?	[IN:CREATE_REMINDER, IN:GET_CONTACT]
reminder	Remove all reminders for dinner with Stacy.	[IN:DELETE_REMINDER, IN:GET_TODO]
reminder	How much time do I have until the next reminder that is set?	[IN:GET_REMINDER_DATE_TIME]
reminder	Set a reminder to make an appointment with the dermatologist in October.	[IN:CREATE_REMINDER, IN:GET_TODO]
reminder	set an alert for tuesday at 6pm to message mike about the gathering	[IN:CREATE_REMINDER, IN:SEND_MESSAGE, IN:GET_EVENT]
reminder	what day and time was that reminder set for Julie's engagement?	[IN:GET_REMINDER_DATE_TIME]
reminder	what time is the alert for my Monday morning staff meetings.	[IN:GET_REMINDER_DATE_TIME, IN:GET_TODO]
reminder	Change all reminders for the spin class.	[IN:UPDATE_REMINDER]
reminder	Change 9pm reminder from daily to weekly	[IN:UPDATE_REMINDER, IN:GET_RECURRING_DATE_TIME, IN:GET_RECURRING_DATE_TIME]
reminder	Find the location reminder for corporate dinner.	[IN:GET_REMINDER_LOCATION]
reminder	Remove my reminder about dinner with Amanda this Saturday	[IN:DELETE_REMINDER, IN:GET_TODO]
reminder	Show me the next reminder.	[IN:GET_REMINDER]
reminder	get all my weekend reminders with chris	[IN:GET_REMINDER, IN:GET_TODO]
reminder	Delete weekly meetings with Gilly at 4pm.	[IN:DELETE_REMINDER, IN:GET_TODO, IN:GET_RECURRING_DATE_TIME]
reminder	change saturday's lunch reminder to say don't forget the chips	[IN:UPDATE_REMINDER_TODO]
reminder	Remove my dinner reminder with Alex for tomorrow night.	[IN:DELETE_REMINDER, IN:GET_TODO]
reminder	What time is my reminder set for on the 22nd?	[IN:GET_REMINDER_DATE_TIME]
reminder	Set a reminder for my mother to bring Leah to softball practice.	[IN:CREATE_REMINDER, IN:GET_CONTACT]
reminder	Setup a reminder for my Mom for her appointment next Monday at noon.	[IN:CREATE_REMINDER, IN:GET_CONTACT]
reminder	how to see yesterday's reminder	[IN:HELP_REMINDER]
reminder	Show reminders with John today at 5	[IN:GET_REMINDER, IN:GET_TODO]
reminder	Remind me to email Natalie in the morning regarding the spelling bee.	[IN:CREATE_REMINDER, IN:GET_TODO, IN:SEND_MESSAGE]
reminder	Adjust the time to 3:00 pm on my next reminder	[IN:UPDATE_REMINDER_DATE_TIME]
reminder	I need to invite Kevin and Jane to dinner -- please send me a reminder to email them tomorrow	[IN:CREATE_REMINDER, IN:SEND_MESSAGE]
reminder	Add a note to my taxes reminder: don't forget the W2.	[IN:UPDATE_REMINDER_TODO]
reminder	Show me my latest reminder about the show I wanted to see next week	[IN:GET_REMINDER]
reminder	When is my reminder to text my father?	[IN:GET_REMINDER_DATE_TIME, IN:SEND_MESSAGE, IN:GET_CONTACT]
reminder	What is on my reminder with Charles	[IN:GET_REMINDER, IN:GET_TODO]
reminder	add buy milk to my shopping reminder	[IN:UPDATE_REMINDER_TODO]
reminder	Remind me to change my underwear every morning at 8 am instead of every other day.	[IN:UPDATE_REMINDER, IN:GET_RECURRING_DATE_TIME, IN:GET_RECURRING_DATE_TIME]
reminder	Please send a reminder to my mom to have dad take his new medication tomorrow.	[IN:CREATE_REMINDER, IN:GET_CONTACT]
reminder	Please give me all of my husband's reminders for VA appointments next month.	[IN:GET_REMINDER, IN:GET_CONTACT]
reminder	how many more weeks until my dads birthday reminder	[IN:GET_REMINDER_DATE_TIME]
reminder	Delete the reminder for dinner with the Wilson's.	[IN:DELETE_REMINDER, IN:GET_TODO]
reminder	Change my computer class reminder to 7pm weekly.	[IN:UPDATE_REMINDER, IN:GET_RECURRING_DATE_TIME]
reminder	please change the time of the reminder for Saturday of next week.	[IN:UPDATE_REMINDER]
reminder	Delete the reminder for our beach trip on Saturday	[IN:DELETE_REMINDER, IN:GET_TODO]
reminder	remind me to email the paychecks	[IN:CREATE_REMINDER, IN:SEND_MESSAGE]
reminder	When is the alert for sons counseling	[IN:GET_REMINDER_DATE_TIME]
reminder	Can you remind me to send out my email marketing letter by Friday	[IN:CREATE_REMINDER, IN:SEND_MESSAGE]
reminder	can you add recycleables to my thursday trash reminder	[IN:UPDATE_REMINDER_TODO]
reminder	what is the location of my next reminders	[IN:GET_REMINDER_LOCATION]
reminder	Remind Mom to buy milk and bread at 5pm tonight.	[IN:CREATE_REMINDER, IN:GET_CONTACT]
reminder	When is my net reminder for paying my Discover card	[IN:GET_REMINDER_DATE_TIME]
reminder	When is my reminder to meet with Joseph	[IN:GET_REMINDER_DATE_TIME, IN:GET_TODO]
reminder	create reminder for meeting with Jane next week	[IN:CREATE_REMINDER, IN:GET_TODO]
reminder	Set bedtime reminder for my son starting August 20th.	[IN:CREATE_REMINDER, IN:GET_CONTACT]
reminder	What time is Fridays meeting reminder set for	[IN:GET_REMINDER_DATE_TIME]
reminder	When is my alert for the birthday party for Sarah?	[IN:GET_REMINDER_DATE_TIME]
reminder	When is my next reminder for my pageant group?	[IN:GET_REMINDER]
reminder	Can you remind me when dinner is with Joe?	[IN:GET_REMINDER_DATE_TIME, IN:GET_TODO]
reminder	What location is my reminder at for tomorrow?	[IN:GET_REMINDER_LOCATION]
reminder	I don't want to forget to text my girlfriend about dinner	[IN:CREATE_REMINDER, IN:SEND_MESSAGE, IN:GET_CONTACT]
reminder	Where is the location for my meeting reminder?	[IN:GET_REMINDER_LOCATION]
reminder	remind me to reply to susan	[IN:CREATE_REMINDER, IN:REPLY_MESSAGE]
reminder	How do I view all of my social engagement reminders?	[IN:HELP_REMINDER]
reminder	when is my reminder about noreen's baby shower	[IN:GET_REMINDER_DATE_TIME]
reminder	I need my monthly health check reminder changed to every 6 months.	[IN:UPDATE_REMINDER, IN:GET_RECURRING_DATE_TIME, IN:GET_RECURRING_DATE_TIME]
reminder	Remind me to send a message to my mom to call the gardener.	[IN:CREATE_REMINDER, IN:SEND_MESSAGE, IN:GET_CONTACT]
reminder	Remind me to email Dad.	[IN:CREATE_REMINDER, IN:SEND_MESSAGE, IN:GET_CONTACT]
reminder	Delete the reminder I set about basketball with Andrew.	[IN:DELETE_REMINDER, IN:GET_TODO]
reminder	change my meeting alert with kim to Lisa	[IN:UPDATE_REMINDER]
reminder	Setup a reminder to email job status every Tuesday evening.	[IN:CREATE_REMINDER, IN:SEND_MESSAGE, IN:GET_RECURRING_DATE_TIME]
reminder	how many reminders i have for today	[IN:GET_REMINDER_AMOUNT]
reminder	Move my next dermatology appointment reminder to Thursday at 10 AM	[IN:UPDATE_REMINDER_DATE_TIME]
reminder	How many reminders do I have lined up?	[IN:GET_REMINDER_AMOUNT]
reminder	Update my reminder for my brother birthday.	[IN:UPDATE_REMINDER]
reminder	What reminders do I have next week with Frank?	[IN:GET_REMINDER, IN:GET_TODO]
reminder	change the reminder to email terry from 3 to 6pm	[IN:UPDATE_REMINDER_DATE_TIME, IN:SEND_MESSAGE]
reminder	Cancel my reminder for lunch with Denise next week.	[IN:DELETE_REMINDER, IN:GET_TODO]
reminder	Tell me when I set this reminder	[IN:GET_REMINDER_DATE_TIME]
reminder	Remind Dad to pick up the taxes from the accountant this week.	[IN:CREATE_REMINDER, IN:GET_CONTACT]
reminder	what time will my next reminder be for	[IN:GET_REMINDER_DATE_TIME]
reminder	Please show me reminders about lunch dates with my friends Sally and Diane	[IN:GET_REMINDER, IN:GET_TODO, IN:GET_CONTACT]
reminder	Remind me to reply to Vickie that I can meet with her on Monday	[IN:CREATE_REMINDER, IN:REPLY_MESSAGE]
reminder	What time is my next reminder?	[IN:GET_REMINDER_DATE_TIME]
reminder	Delete get together with Ryan on Monday from my reminders	[IN:DELETE_REMINDER, IN:GET_TODO]
reminder	remind me about my breakfast wit John next week	[IN:CREATE_REMINDER, IN:GET_TODO]
reminder	Delete all reminders I have schedule to meet with John this week	[IN:DELETE_REMINDER, IN:GET_TODO]
reminder	Look up when my next reminder is	[IN:GET_REMINDER_DATE_TIME]
reminder	Change my weekly pill reminders to Wednesday's only.	[IN:UPDATE_REMINDER, IN:GET_RECURRING_DATE_TIME, IN:GET_RECURRING_DATE_TIME]
reminder	remind me to respond to Jeffrey's email at 5pm	[IN:CREATE_REMINDER, IN:REPLY_MESSAGE]
reminder	How do I see all my reminders for the cancer walk fundraiser starting on Monday	[IN:HELP_REMINDER]
reminder	When's the lunch reminder?	[IN:GET_REMINDER_DATE_TIME]
reminder	Delete my daughter's reminder for tomorrow	[IN:DELETE_REMINDER, IN:GET_CONTACT]
reminder	update my reminder to clean under the stove to weekly instead of monthly	[IN:UPDATE_REMINDER, IN:GET_RECURRING_DATE_TIME, IN:GET_RECURRING_DATE_TIME]
reminder	remind my son to go to bed at 8	[IN:CREATE_REMINDER, IN:GET_CONTACT]
reminder	remove the new reminder for my hair appointment with tasha on saturday morning	[IN:DELETE_REMINDER, IN:GET_TODO]
reminder	remind me to text Sean tomorrow	[IN:CREATE_REMINDER, IN:SEND_MESSAGE]
reminder	Remind my sister to pick up mom an hour early on Saturday for brunch	[IN:CREATE_REMINDER, IN:GET_CONTACT, IN:GET_TODO]
reminder	Remind me to meet with my team starting on Mondays at 9:15 am	[IN:CREATE_REMINDER, IN:GET_TODO, IN:GET_RECURRING_DATE_TIME]
reminder	Delay my reminder in one hour	[IN:UPDATE_REMINDER]
reminder	How many reminders are scheduled for tomorrow?	[IN:GET_REMINDER_AMOUNT]
reminder	Tell me the location of the bachelorette party reminder	[IN:GET_REMINDER_LOCATION]
reminder	Where is the lunch meeting reminder happening?	[IN:GET_REMINDER_LOCATION]
reminder	can you remind my dad to send a gift to his mother	[IN:CREATE_REMINDER, IN:GET_CONTACT]
reminder	does my husband have any reminders for me	[IN:GET_REMINDER, IN:GET_CONTACT]
reminder	What time is my date reminder two weeks from today?	[IN:GET_REMINDER_DATE_TIME]
reminder	Add getting cleaning supplies to my shopping reminder for tomorrow.	[IN:UPDATE_REMINDER_TODO]
reminder	Can you remove the last reminder I created about my coffee date?	[IN:DELETE_REMINDER]
reminder	Can I delete tomorrow's reminder for the date with Ashton?	[IN:DELETE_REMINDER, IN:GET_TODO]
reminder	Submit marketing proposal tomorrow before meeting with Sarah reminder	[IN:CREATE_REMINDER, IN:GET_TODO]
reminder	Please remind me I have a meeting with a client tomorrow morning at 7.	[IN:CREATE_REMINDER, IN:GET_TODO]
reminder	Remind me to reply to Steve and tell him we need to reschedule our meeting.	[IN:CREATE_REMINDER, IN:REPLY_MESSAGE]
reminder	remind my kids to buckle their seat belts before leaving the driveway	[IN:CREATE_REMINDER, IN:GET_CONTACT]
reminder	Set up a reminder for my daughter to take the equipment for her training.	[IN:CREATE_REMINDER, IN:GET_CONTACT]
reminder	How many reminders do I have set for Saturday after 5 pm?	[IN:GET_REMINDER_AMOUNT]
reminder	Edit reminder to update time logs from 9:00 pm to 8:30, daily.	[IN:UPDATE_REMINDER, IN:GET_RECURRING_DATE_TIME]
reminder	Add ironing and vacuuming to my Thursday reminders.	[IN:UPDATE_REMINDER_TODO]
reminder	Show the location of the work function reminder next Monday	[IN:GET_REMINDER_LOCATION]
reminder	Where is the reminder for my dinner date with bff?	[IN:GET_REMINDER, IN:GET_TODO]
reminder	Delete reminders of appointment with my doctor this month	[IN:DELETE_REMINDER, IN:GET_TODO]
reminder	Remind me when dinner with my husband is	[IN:CREATE_REMINDER, IN:GET_TODO, IN:GET_CONTACT]
reminder	Remove the reminder about Saturday's meeting with my friends.	[IN:DELETE_REMINDER, IN:GET_TODO, IN:GET_CONTACT]
reminder	How many reminders to I have	[IN:GET_REMINDER_AMOUNT]
reminder	Create a reminder for dad to bring the gas tank to Chloe's birthday party.	[IN:CREATE_REMINDER, IN:GET_CONTACT]
reminder	Can you please tell me about my next work meeting reminder location, time, people going	[IN:GET_REMINDER]
reminder	How many reminders are listed this week for school?	[IN:GET_REMINDER_AMOUNT]
reminder	Remind my sister to pick up my daughter at 2pm; alert 20 minutes beforehand	[IN:CREATE_REMINDER, IN:GET_CONTACT, IN:GET_TODO]
reminder	Modify post office reminder	[IN:UPDATE_REMINDER]
reminder	Don't let me forget to reply to Sue's email; remind me on Thursday.	[IN:CREATE_REMINDER, IN:REPLY_MESSAGE]
reminder	change alert time for kids pick up 10 12pm every wednesday	[IN:UPDATE_REMINDER, IN:GET_RECURRING_DATE_TIME]
reminder	Remove the reminder for my date with ET on Friday.	[IN:DELETE_REMINDER, IN:GET_TODO]
reminder	Please edit my weekly work reminder to be every other week.	[IN:UPDATE_REMINDER, IN:GET_RECURRING_DATE_TIME, IN:GET_RECURRING_DATE_TIME]
reminder	What time is the arrival on Sunday's reminder	[IN:GET_REMINDER_DATE_TIME]
reminder	Are there any reminders for dinner next week with Mom?	[IN:GET_REMINDER, IN:GET_TODO, IN:GET_CONTACT]
reminder	remind me of lunch today with janel at 1 pm	[IN:CREATE_REMINDER, IN:GET_TODO]
reminder	How many reminders do I have set from 7 am to 8 pm tomorrow	[IN:GET_REMINDER_AMOUNT]
reminder	Add beer to my weekly shopping reminder.  I need it.	[IN:UPDATE_REMINDER_TODO, IN:GET_RECURRING_DATE_TIME]
reminder	Set up a reminder about my meeting with Rick on Monday morning at 11 a.m.	[IN:CREATE_REMINDER, IN:GET_TODO]
reminder	Set up a daily reminder for my daughter to read for 30 minutes.	[IN:CREATE_REMINDER, IN:GET_RECURRING_DATE_TIME, IN:GET_CONTACT, IN:GET_TODO]
reminder	Set a reminder for August 10th at 8pm to email my mother about plans to go to Brooklyn.	[IN:CREATE_REMINDER, IN:SEND_MESSAGE, IN:GET_CONTACT]
reminder	The schedule for cleaning the office break room reminder needs to be changed to monthly instead of weekly	[IN:UPDATE_REMINDER, IN:GET_RECURRING_DATE_TIME, IN:GET_RECURRING_DATE_TIME]
reminder	Change my recurring nail appointment reminder from weekly to every two weeks.	[IN:UPDATE_REMINDER, IN:GET_RECURRING_DATE_TIME, IN:GET_RECURRING_DATE_TIME]
reminder	When is my next quarterly report reminder	[IN:GET_REMINDER_DATE_TIME]
reminder	Delete the reminder to meet with Carlos tomorrowat 10am.	[IN:DELETE_REMINDER, IN:GET_TODO]
reminder	When’s the reminder about the game tonight	[IN:GET_REMINDER_DATE_TIME]
reminder	please update my work reminder for new meeting at 9 am every thursday now	[IN:UPDATE_REMINDER_TODO, IN:GET_RECURRING_DATE_TIME]
reminder	I need to add Chuck to the surprise party reminder next weekend.	[IN:UPDATE_REMINDER]
reminder	What's my next couple reminders?	[IN:GET_REMINDER]
reminder	Remind me of my meeting with President Trump next week Thursday at 2 PM.	[IN:CREATE_REMINDER, IN:GET_TODO]
reminder	Do I have any reminders set for my next work meeting?	[IN:GET_REMINDER]
reminder	Remind me to email Mom insurance information.	[IN:CREATE_REMINDER, IN:SEND_MESSAGE, IN:GET_CONTACT]
reminder	How do I see reminders involving non-work events	[IN:HELP_REMINDER]
reminder	When and where is the date night with wife reminder	[IN:GET_REMINDER, IN:GET_TODO]
reminder	when is my next reminder	[IN:GET_REMINDER_DATE_TIME]
reminder	Show my last reminder.	[IN:GET_REMINDER]
reminder	Show me the location of my dinner reminder with Kellie	[IN:GET_REMINDER_LOCATION, IN:GET_TODO]
reminder	Delete all of my reminders for meetings with Kim.	[IN:DELETE_REMINDER, IN:GET_TODO]
reminder	How many reminders do I have	[IN:GET_REMINDER_AMOUNT]
reminder	Change my reminder to feed the dog so it occurs daily.	[IN:UPDATE_REMINDER, IN:GET_RECURRING_DATE_TIME]
reminder	remind me to email the children's school supply list to their dad tomorrow	[IN:CREATE_REMINDER, IN:SEND_MESSAGE, IN:GET_CONTACT]
reminder	Remind me to reply to Lyndy and tell her I can meet at Starbucks at 9:45 a.m.	[IN:CREATE_REMINDER, IN:REPLY_MESSAGE]
reminder	Set up a reminder for my mother to cancel her Sirius XM radio subscription August 25th, 2018.	[IN:CREATE_REMINDER, IN:GET_CONTACT]
reminder	What time is my first reminder set for?	[IN:GET_REMINDER_DATE_TIME]
reminder	Remind me that I need to reschedule my appointment with Darry on the 18th to after school and not in the morining.	[IN:CREATE_REMINDER, IN:GET_TODO]
reminder	change reminder notification	[IN:UPDATE_REMINDER]
reminder	Do I have a reminder set for lunch with Jennifer on the 23rd?	[IN:GET_REMINDER, IN:GET_TODO]
reminder	delete reminders daily reminders to send group text Siblings until next week	[IN:DELETE_REMINDER, IN:GET_RECURRING_DATE_TIME, IN:GET_TODO, IN:SEND_MESSAGE, IN:GET_CONTACT]
reminder	What time is the Friends dinner reminder at?	[IN:GET_REMINDER_DATE_TIME]
reminder	please change our monthly meeting reminder to weekly	[IN:UPDATE_REMINDER, IN:GET_RECURRING_DATE_TIME, IN:GET_RECURRING_DATE_TIME]
reminder	What reminders do I have with Ruth?	[IN:GET_REMINDER, IN:GET_TODO]
reminder	cancel my reminder to meet with lawyers	[IN:DELETE_REMINDER, IN:GET_TODO]
reminder	Do I have any reminders with my sister during sunset?	[IN:GET_REMINDER, IN:GET_TODO, IN:GET_CONTACT]
reminder	set up reminder for tennis match with Jill	[IN:CREATE_REMINDER, IN:GET_TODO]
reminder	Set up a weekly reminder to email the team about updates on Friday Morning	[IN:CREATE_REMINDER, IN:GET_RECURRING_DATE_TIME, IN:GET_TODO, IN:SEND_MESSAGE]
reminder	I need to create a reminder notification to meet with Fran via skype every other week to practice our presentation	[IN:CREATE_REMINDER, IN:GET_TODO, IN:GET_RECURRING_DATE_TIME]
reminder	How do I make a reminder for recurring events?	[IN:HELP_REMINDER]
reminder	Change my appointment reminder with Kirbi from 2:00 pm to 4:00 pm.	[IN:UPDATE_REMINDER_DATE_TIME]
reminder	Remind me to email Mrs. Yvonne about the Desktop Project Payment.	[IN:CREATE_REMINDER, IN:SEND_MESSAGE]
reminder	What day is my next reminder set for	[IN:GET_REMINDER_DATE_TIME]
reminder	Show me my next reminder	[IN:GET_REMINDER]
reminder	I need to text Nicquana tonight at 7pm. Can you remind me?	[IN:CREATE_REMINDER, IN:SEND_MESSAGE]
reminder	How many reminders are set for this week?	[IN:GET_REMINDER_AMOUNT]
reminder	Remove the reminder for brunch tomorrow with Danny.	[IN:DELETE_REMINDER, IN:GET_TODO]
reminder	set a reminder to go to the movies on saturday with bob	[IN:CREATE_REMINDER, IN:GET_TODO]
reminder	Set up a reminder for daughter to do her homework every week night at 5:00 p.m.	[IN:CREATE_REMINDER, IN:GET_CONTACT, IN:GET_RECURRING_DATE_TIME]
reminder	when was my reminder for the dentist	[IN:GET_REMINDER_DATE_TIME]
reminder	Cancel my second flight reminder.	[IN:DELETE_REMINDER]
reminder	alert me about the next reminder for tomorrow morning	[IN:CREATE_REMINDER]
reminder	When did I set my reminder to water the plants?	[IN:GET_REMINDER_DATE_TIME]
reminder	When is the reminder about waking up?	[IN:GET_REMINDER_DATE_TIME]
reminder	Make the rent reminder happen the 1st of every month	[IN:UPDATE_REMINDER, IN:GET_RECURRING_DATE_TIME]
reminder	Set the reminder for August 15th to sit with Carol to go over her work before she goes on vacation.	[IN:CREATE_REMINDER, IN:GET_TODO]
reminder	Show me my reminder for meeting up with Jason, while I am visiting.	[IN:GET_REMINDER, IN:GET_TODO]
reminder	Change the time for the event reminder that I created yesterday.	[IN:UPDATE_REMINDER]
reminder	when is my next meet up reminder	[IN:GET_REMINDER_DATE_TIME]
reminder	change the reminder to do laundry to do ironing instead	[IN:UPDATE_REMINDER_TODO]
reminder	Change the reminder to email my landlord to Sunday	[IN:UPDATE_REMINDER_DATE_TIME, IN:SEND_MESSAGE]
reminder	Remind me to email Maryann about our bus trip.	[IN:CREATE_REMINDER, IN:SEND_MESSAGE]
reminder	Remind me to make reservations at our favorite restaurant for a date with my husband for Friday night at 7 pm.	[IN:CREATE_REMINDER, IN:GET_TODO, IN:GET_CONTACT]
reminder	i need to schedule a meeting with my accountant next week, remind me tomorrow	[IN:CREATE_REMINDER, IN:GET_TODO]
reminder	display my last reminder	[IN:GET_REMINDER]
reminder	Add Bob to my reminder regarding employment.	[IN:UPDATE_REMINDER]
reminder	Add workout to my daily to do list reminder	[IN:UPDATE_REMINDER_TODO, IN:GET_RECURRING_DATE_TIME]
reminder	set a reminder in 2 hours to text my sister	[IN:CREATE_REMINDER, IN:SEND_MESSAGE, IN:GET_CONTACT]
reminder	Send a reminder to my friends about our brunch tomorrow at 2 pm	[IN:CREATE_REMINDER, IN:GET_CONTACT]
reminder	when is my first reminder for a meeting next week	[IN:GET_REMINDER_DATE_TIME]
reminder	Can you remind me to go out dinner with my kids?	[IN:CREATE_REMINDER, IN:GET_TODO, IN:GET_CONTACT]
reminder	Remind me to text Jenna about the potluck list on Saturday.	[IN:CREATE_REMINDER, IN:SEND_MESSAGE]
reminder	Add reminder to email Tammy before noon on Tuesday regarding the Evans project	[IN:CREATE_REMINDER, IN:GET_TODO, IN:SEND_MESSAGE]
reminder	When is my next reminder for Jaida's Birthday dinner?	[IN:GET_REMINDER_DATE_TIME]
reminder	Please send my sister Donna a reminder tomorrow about Keith's surgery on Wednesday	[IN:CREATE_REMINDER, IN:GET_CONTACT, IN:GET_TODO]
reminder	Add prescription refills to my reminder list for Thursday	[IN:UPDATE_REMINDER_TODO]
reminder	Update my reminder for my meeting with Steve to 2pm.	[IN:UPDATE_REMINDER_DATE_TIME]
reminder	What day is the reminder for Jenny's hair appointment set for?	[IN:GET_REMINDER_DATE_TIME]
reminder	Schedule a reminder to message Sam tonight.	[IN:CREATE_REMINDER, IN:SEND_MESSAGE]
reminder	how many reminders are there	[IN:GET_REMINDER_AMOUNT]
reminder	Remind my husband that it's our anniversary tomorrow	[IN:CREATE_REMINDER, IN:GET_CONTACT]
reminder	Change monthly meetings reminder to also include pick up donuts for meetings	[IN:UPDATE_REMINDER_TODO, IN:GET_RECURRING_DATE_TIME]
reminder	Move tomorrow's first reminder to tonight.	[IN:UPDATE_REMINDER_DATE_TIME]
reminder	Delete the reminder to play tennis with Shelly.	[IN:DELETE_REMINDER, IN:GET_TODO]
reminder	Send my mom a reminder to pick up bread.	[IN:CREATE_REMINDER, IN:GET_CONTACT]
reminder	Remind me to email Dad tomorrow about seeing his friend on TV.	[IN:CREATE_REMINDER, IN:GET_TODO, IN:SEND_MESSAGE, IN:GET_CONTACT]
reminder	remind me to text my brother tomorrow	[IN:CREATE_REMINDER, IN:SEND_MESSAGE, IN:GET_CONTACT]
reminder	remind my husband to get the clothes out of the dryer tomorrow morning	[IN:CREATE_REMINDER, IN:GET_CONTACT]
reminder	Set up a reminder for my sister that I won't be available until after 5 pm tomorrow.	[IN:CREATE_REMINDER, IN:GET_CONTACT]
reminder	Where does tomorrow's reminder say I need to meet up with Tammy?	[IN:GET_REMINDER_LOCATION, IN:GET_TODO]
reminder	remind me to send an email to Shenita by 7pm today	[IN:CREATE_REMINDER, IN:SEND_MESSAGE]
reminder	What are my next two weekend reminders?	[IN:GET_REMINDER]
