domain	utterance	intents
reminder	Reschedule my reminder from today to the same time tomorrow.	[IN:UPDATE_REMINDER_DATE_TIME]
reminder	Show me my reminders from June 21st.	[IN:GET_REMINDER]
reminder	Read me all of my birthday reminders for the month of June.	[IN:GET_REMINDER]
reminder	Recur a reminder every morning to take a multivitamin	[IN:CREATE_REMINDER, IN:GET_RECURRING_DATE_TIME]
reminder	Set me up an alert to go to my mother's doctors appointment Friday January 6th 3 p.m. .	[IN:CREATE_REMINDER, IN:GET_TODO]
reminder	Remind me to email Joy about the details with the new client tonight	[IN:CREATE_REMINDER, IN:SEND_MESSAGE]
reminder	Remind me to text Minky about the concert on Thursday.	[IN:CREATE_REMINDER, IN:SEND_MESSAGE, IN:GET_EVENT]
reminder	Show all my reminders!	[IN:GET_REMINDER]
reminder	DOES JEAN HAVE ANY REMINDERS SET UP?	[IN:GET_REMINDER]
reminder	Show me all my reminders for this weekend	[IN:GET_REMINDER]
reminder	Delete the alert on my reminder for a playdate with Kim tomorrow.	[IN:DELETE_REMINDER, IN:GET_TODO]
reminder	Remind us about taxes due on Wednesday instead of Saturday.	[IN:UPDATE_REMINDER_DATE_TIME]
reminder	remind me to pick up coffee for meeting tomorrow morning for work.	[IN:CREATE_REMINDER, IN:GET_TODO]
reminder	Add shopping for a new dress to my to do list reminder	[IN:UPDATE_REMINDER]
reminder	add 'buy eggs' to reminder	[IN:UPDATE_REMINDER_TODO]
reminder	Remind me on Tuesday morning about the dentist instead of Monday afternoon.	[IN:UPDATE_REMINDER_DATE_TIME]
reminder	can you remind me about my eye doc appointment on wednesday on tueday	[IN:CREATE_REMINDER, IN:GET_TODO]
reminder	remind me to buy laundry detergent tonight please.	[IN:CREATE_REMINDER, IN:GET_TODO]
reminder	please add additional reminder set for tuesday for pizza party on sunday	[IN:CREATE_REMINDER, IN:GET_TODO]
reminder	Don't forget to remind me a half hour before Jill gets out of class Monday through Friday, starting this Monday.	[IN:CREATE_REMINDER, IN:GET_TODO]
reminder	How many booked concert reminders do I have this month?	[IN:GET_REMINDER]
reminder	please delete my lunch reminder with Ed tomorrow	[IN:DELETE_REMINDER, IN:GET_TODO]
reminder	Do i have any TV reminders set	[IN:GET_REMINDER]
reminder	What are today's reminders?	[IN:GET_REMINDER]
reminder	Find me the reminders I set for Thursday	[IN:GET_REMINDER]
reminder	remind me to Visit a suburb in my  city that you've never been to before every Saturday	[IN:CREATE_REMINDER, IN:GET_RECURRING_DATE_TIME]
reminder	When is my next reminder for Sunday?	[IN:GET_REMINDER_DATE_TIME]
reminder	Please show me all reminders.	[IN:GET_REMINDER]
reminder	Change my appointment reminder from Thursday to Friday.	[IN:UPDATE_REMINDER_DATE_TIME]
reminder	Set up a reminder for 7 PM to water the garden tonight.	[IN:CREATE_REMINDER, IN:GET_TODO]
reminder	Delete all reminders to paint the room.	[IN:DELETE_REMINDER]
reminder	Cancel tomorrow's reminder for dinner with Jeff and reschedule it for wednesday at 6.	[IN:UPDATE_REMINDER_DATE_TIME]
reminder	Delete all my reminders about the party for Sunday	[IN:DELETE_REMINDER]
reminder	remind my son Monday through Friday that his bus will be coming at 7:30 am	[IN:CREATE_REMINDER, IN:GET_CONTACT, IN:GET_TODO]
reminder	Can you delete all weekend reminders for next month.	[IN:DELETE_REMINDER]
reminder	What reminder do I have for this afternoon?	[IN:GET_REMINDER]
reminder	Set up a reminder for Sarah to let the dogs out every night.	[IN:CREATE_REMINDER, IN:GET_RECURRING_DATE_TIME]
reminder	change the return books reminder from 11am to 3pm	[IN:UPDATE_REMINDER_DATE_TIME]
reminder	change alert to 7:30am everyday fo the next 2 weeks	[IN:UPDATE_REMINDER, IN:GET_RECURRING_DATE_TIME]
reminder	change the reminder about dinner today to 6pm instead of 5pm	[IN:UPDATE_REMINDER_DATE_TIME, IN:GET_TODO]
reminder	Set up todays reminder to repeat on the same time every day.	[IN:UPDATE_REMINDER, IN:GET_RECURRING_DATE_TIME]
reminder	Do i have any day time reminders	[IN:GET_REMINDER]
reminder	Set up a recurring reminder for Skyler's counseling appointments every Monday at 6pm.	[IN:CREATE_REMINDER, IN:GET_RECURRING_DATE_TIME]
reminder	Set up a weekly reminder for Ben to empty the trash can starting Tuesday.	[IN:CREATE_REMINDER, IN:GET_RECURRING_DATE_TIME]
reminder	When is my reminder about my parent's visiting?	[IN:GET_REMINDER_DATE_TIME]
reminder	Read me all my reminders from Wednesday.	[IN:GET_REMINDER]
reminder	Set up a weekly reminder about practice on wednesdays.	[IN:CREATE_REMINDER, IN:GET_RECURRING_DATE_TIME, IN:GET_TODO]
reminder	Remind me of bowling every Thursday at 7 PM	[IN:CREATE_REMINDER, IN:GET_RECURRING_DATE_TIME]
reminder	Set a reminder for my mom about our dinner date tomorrow.	[IN:CREATE_REMINDER, IN:GET_CONTACT]
reminder	Update all my reminders to fit my new work schedule.	[IN:UPDATE_REMINDER]
reminder	can you alert me 10 minutes before today's meeting	[IN:CREATE_REMINDER, IN:GET_TODO]
reminder	set reminder for the pantry food drive during july and remind everyone  the kick off will sponser a band on the 1st fri night check dates	[IN:CREATE_REMINDER, IN:GET_TODO, IN:GET_TODO]
reminder	remind me to email the team about practice on Thursday at 6:00	[IN:CREATE_REMINDER, IN:SEND_MESSAGE]
reminder	Remind Dave to pick me up at 4; Remind him 20 mins. early.	[IN:CREATE_REMINDER, IN:GET_TODO]
reminder	Remind me to fast on Monday night because I have a blood draw the next morning.	[IN:CREATE_REMINDER, IN:GET_TODO]
reminder	Can you remind me that I have a dinner meeting with John next Tuesday at 7 pm.	[IN:CREATE_REMINDER, IN:GET_TODO]
reminder	Update the time to 12:00 pm on  Back 2 school BBQ reminder	[IN:UPDATE_REMINDER_DATE_TIME]
reminder	remind john to take his medicine at 9 am everyday	[IN:CREATE_REMINDER, IN:GET_RECURRING_DATE_TIME]
reminder	Update reminder for anniversary dinner to 8pm instead of 6pm.	[IN:UPDATE_REMINDER_DATE_TIME]
reminder	Change my reminder to pick up the dry cleaning to Thursday please.	[IN:UPDATE_REMINDER_DATE_TIME]
reminder	show all reminders for my Octobers doctor's apportionments	[IN:GET_REMINDER, IN:GET_TODO]
reminder	i don't want to miss the shuttle at 5a, alert me at 3a	[IN:CREATE_REMINDER, IN:GET_TODO]
reminder	change the group reminder about dues to Tuesday	[IN:UPDATE_REMINDER_DATE_TIME]
reminder	Modify tomorrow's wake up reminder for my daughter.	[IN:UPDATE_REMINDER, IN:GET_CONTACT]
reminder	Set up weekly reminder to consolidate finances, every Friday beginning this week.	[IN:CREATE_REMINDER, IN:GET_RECURRING_DATE_TIME, IN:GET_TODO, IN:GET_RECURRING_DATE_TIME]
reminder	Remind Nathan every day at 3 to feed the goats.	[IN:CREATE_REMINDER, IN:GET_RECURRING_DATE_TIME]
reminder	Add pizza menu to the reminder tonight	[IN:UPDATE_REMINDER_TODO]
reminder	Remind me on July 11th every year about my mothers birthday.	[IN:CREATE_REMINDER, IN:GET_RECURRING_DATE_TIME]
reminder	When are Hayden's fantasy football draft reminders	[IN:GET_REMINDER_DATE_TIME]
reminder	Remove the reminder to meet with Miley on Saturday.	[IN:DELETE_REMINDER, IN:GET_TODO]
reminder	Set up a reminder for me to mail out my car insurance payment to my father on the 5th of every month.	[IN:CREATE_REMINDER, IN:GET_RECURRING_DATE_TIME]
reminder	Remind me to email Alex about the company new schedule.	[IN:CREATE_REMINDER, IN:SEND_MESSAGE]
reminder	Tell me my reminders for today	[IN:GET_REMINDER]
reminder	Setup remind for facetime with suegra Saturday	[IN:CREATE_REMINDER, IN:GET_TODO]
reminder	change my daily reminder to 6	[IN:UPDATE_REMINDER_DATE_TIME, IN:GET_RECURRING_DATE_TIME]
reminder	How many reminders do I have set for this month?	[IN:GET_REMINDER_AMOUNT]
reminder	Remind me 7 am dentist's appointment	[IN:CREATE_REMINDER, IN:GET_TODO]
reminder	How do I see my reminders?	[IN:HELP_REMINDER]
reminder	Add visit to church in my reminder for Sunday.	[IN:UPDATE_REMINDER_TODO]
reminder	When's my next reminder, and what is it for and for who?	[IN:GET_REMINDER]
reminder	Update my weekly facial reminder to be monthly instead.	[IN:UPDATE_REMINDER, IN:GET_RECURRING_DATE_TIME, IN:GET_RECURRING_DATE_TIME]
reminder	update the time for my meeting reminder from 8 to 9 am tomorrow	[IN:UPDATE_REMINDER_DATE_TIME]
reminder	remind me to text Kathy about the party.	[IN:CREATE_REMINDER, IN:SEND_MESSAGE, IN:GET_EVENT]
reminder	Show me all the reminders for Zeus this month.	[IN:GET_REMINDER]
reminder	set the reminder every day to take my vitamins	[IN:CREATE_REMINDER, IN:GET_RECURRING_DATE_TIME]
reminder	May you set a reminder to look at my class schedule every evening at 8 pm?	[IN:CREATE_REMINDER, IN:GET_RECURRING_DATE_TIME]
reminder	When are the JUMC admin council reminders?	[IN:GET_REMINDER_DATE_TIME]
reminder	Show me reminders of Tee times for this week.	[IN:GET_REMINDER]
reminder	Show me all of my makeup artistry work reminders.	[IN:GET_REMINDER]
reminder	Show me the pool cleaning reminder	[IN:GET_REMINDER]
reminder	Turn of all reminders	[IN:DELETE_REMINDER]
reminder	cancel all of today's reminders	[IN:DELETE_REMINDER]
reminder	Remind me every month on the 28th to pay the homeowner's fee.	[IN:CREATE_REMINDER, IN:GET_RECURRING_DATE_TIME]
reminder	Delete my reminder for dinner with Mary on Tuesday.	[IN:DELETE_REMINDER, IN:GET_TODO]
reminder	Please show me reminders for all dates with my husband	[IN:GET_REMINDER, IN:GET_TODO, IN:GET_CONTACT]
reminder	Remind me to email Frankie about our next meeting	[IN:CREATE_REMINDER, IN:SEND_MESSAGE]
reminder	change my baseball reminder on tuesday	[IN:UPDATE_REMINDER]
reminder	Remind me when it my anniversary with my boyfriend	[IN:CREATE_REMINDER, IN:GET_TODO, IN:GET_CONTACT]
reminder	show me all the reminders for this morning	[IN:GET_REMINDER]
reminder	Set up a weekly reminder that Dinnerly is delivered on Tuesdays.	[IN:CREATE_REMINDER, IN:GET_RECURRING_DATE_TIME, IN:GET_TODO]
reminder	Delete my reminder about Sunday's breakfast with Maralyse.	[IN:DELETE_REMINDER, IN:GET_TODO]
reminder	Remind me to drink water every hour	[IN:CREATE_REMINDER, IN:GET_RECURRING_DATE_TIME]
reminder	Change tomorrow's reminder to 4 instead of 2.	[IN:UPDATE_REMINDER_DATE_TIME]
reminder	remind my husband about his haircut appointment	[IN:CREATE_REMINDER, IN:GET_CONTACT]
reminder	Remove all reminders for medication for the next three days.	[IN:DELETE_REMINDER]
reminder	Set doctor's appointment reminder every Wednesday	[IN:CREATE_REMINDER, IN:GET_RECURRING_DATE_TIME]
reminder	remind chris to buy orange juice and champagne for tomorrow's brunch	[IN:CREATE_REMINDER, IN:GET_TODO]
reminder	show me my reminder	[IN:GET_REMINDER]
reminder	Forget all work-related reminders	[IN:DELETE_REMINDER]
reminder	i have to pick the kids up at 4, remind me at 3:30	[IN:CREATE_REMINDER, IN:GET_TODO]
reminder	Set up a daily reminder at 10:00pm to take my pills.	[IN:CREATE_REMINDER, IN:GET_RECURRING_DATE_TIME]
reminder	Remind me that Bruce is arriving the day after tomorrow.	[IN:CREATE_REMINDER, IN:GET_TODO]
reminder	Can you show me my reminders for doctors appointments?	[IN:GET_REMINDER]
reminder	Please tell me how many reminders I have for school activities.	[IN:GET_REMINDER_AMOUNT]
reminder	Show me all reminders for my son's football games	[IN:GET_REMINDER]
reminder	Remove Gary from all reminders I have setup with him included.	[IN:UPDATE_REMINDER]
reminder	show reminders for oil change on all of our cars	[IN:GET_REMINDER]
reminder	cancel all reminders for tomorrow	[IN:DELETE_REMINDER]
reminder	Set a reminder 2 hours before my 9 pm date.	[IN:CREATE_REMINDER, IN:GET_TODO]
reminder	Remind about maggies's birthday on Tuesday instead of wednesday.	[IN:UPDATE_REMINDER_DATE_TIME]
reminder	Remind me to send a birthday text to my mom on August 3rd	[IN:CREATE_REMINDER, IN:SEND_MESSAGE, IN:GET_CONTACT]
reminder	Delete all reminders prior to July 1, 2018.	[IN:DELETE_REMINDER]
reminder	Please reming me to renew me medical prescription every two weeks.	[IN:CREATE_REMINDER, IN:GET_RECURRING_DATE_TIME]
reminder	Remind me to drink water everyday at 10 am	[IN:CREATE_REMINDER, IN:GET_RECURRING_DATE_TIME]
reminder	Delete my reminder about tomorrow doctors appointment	[IN:DELETE_REMINDER, IN:GET_TODO]
reminder	I want to see all my reminders for next month.	[IN:GET_REMINDER]
reminder	I don't want to forget about my doctor's appointment at 2:15 p.m. this Friday; remind me 2 hours beforehand.	[IN:CREATE_REMINDER, IN:GET_TODO]
reminder	Remind me to take a photo for the day at 7:15 pm daily.	[IN:CREATE_REMINDER, IN:GET_RECURRING_DATE_TIME]
reminder	tell me all my reminders for next tuesday	[IN:GET_REMINDER]
reminder	Set up a reminder to meet Ellie's teacher today at 5:00 pm; Remind me 30 minutes before	[IN:CREATE_REMINDER, IN:GET_TODO]
reminder	Update my meeting reminder to tomorrow.	[IN:UPDATE_REMINDER_DATE_TIME]
reminder	Change my reminder to 3pm	[IN:UPDATE_REMINDER_DATE_TIME]
reminder	Read all of my reminders for today.	[IN:GET_REMINDER]
reminder	change reminder to watch walking dead to alert me 1 hour before	[IN:UPDATE_REMINDER_DATE_TIME]
reminder	remind me to drop off library books every monday	[IN:CREATE_REMINDER, IN:GET_RECURRING_DATE_TIME]
reminder	Set reminder to get groceries 15 minutes before movie date with Bob.	[IN:CREATE_REMINDER, IN:GET_TODO]
reminder	Remind me of my lunch date with Paul next week	[IN:CREATE_REMINDER, IN:GET_TODO]
reminder	Set a reminder for Jack to email a status update on the project by 3pm tomorrow	[IN:CREATE_REMINDER, IN:SEND_MESSAGE]
reminder	Add to my dinner reminder an alert to take my pills	[IN:UPDATE_REMINDER_TODO]
reminder	Hey Bot! Please list out all my reminders for this week.	[IN:GET_REMINDER]
reminder	I want to see the reminder of when I need to feed the fish next.	[IN:GET_REMINDER]
reminder	I don't need a reminder for the birthday party this evening remove it	[IN:DELETE_REMINDER, IN:GET_TODO]
reminder	Change reminder to 10 o’clock	[IN:UPDATE_REMINDER_DATE_TIME]
reminder	set a daily reminder for medicine	[IN:CREATE_REMINDER, IN:GET_RECURRING_DATE_TIME]
reminder	put in a reminder for Yoga class Thursday mornings at 7:00 AM next 8 weeks.	[IN:CREATE_REMINDER, IN:GET_RECURRING_DATE_TIME]
reminder	i need to set a reminder to take the medicine every day at 2pm	[IN:CREATE_REMINDER, IN:GET_RECURRING_DATE_TIME]
reminder	Remind Krissy about brunch on Saturday instead of Friday.	[IN:UPDATE_REMINDER_DATE_TIME]
reminder	What time is my reminder set for ""Pay the mortgage""?	[IN:GET_REMINDER_DATE_TIME]
reminder	Pull up all of the reminders from today	[IN:GET_REMINDER]
reminder	remind me to get puppy at 3, not 7	[IN:UPDATE_REMINDER_DATE_TIME]
reminder	Can remind me every Saturday to run my anti-virus software on my iMac?	[IN:CREATE_REMINDER, IN:GET_RECURRING_DATE_TIME]
reminder	Set up a reminder for the monthly budget report on the 15th of each month at 12 pm.	[IN:CREATE_REMINDER, IN:GET_RECURRING_DATE_TIME]
reminder	remind me to cancel the cable tomorrow after work	[IN:CREATE_REMINDER, IN:GET_TODO]
reminder	change the wake up reminders from 5;30am to 5;45am since i need that extra 15 minutes of sleep	[IN:UPDATE_REMINDER_DATE_TIME]
reminder	remind me to unplug the curling iron each morning	[IN:CREATE_REMINDER, IN:GET_RECURRING_DATE_TIME]
reminder	When is my reminder Lunch date with Brad?	[IN:GET_REMINDER_DATE_TIME, IN:GET_TODO]
reminder	Can you remove all reminders for next week?	[IN:DELETE_REMINDER]
reminder	Show me work reminders.	[IN:GET_REMINDER]
reminder	Set up a reminder to check my account for the deposit on the 3rd of every month.	[IN:CREATE_REMINDER, IN:GET_RECURRING_DATE_TIME]
reminder	Remind me to think and grow rich everyday at 8 am,	[IN:CREATE_REMINDER, IN:GET_RECURRING_DATE_TIME]
reminder	show me the reminders for tomorrow	[IN:GET_REMINDER]
reminder	Show my reminder list	[IN:GET_REMINDER]
reminder	Remind my Mom that I'll host dinner	[IN:CREATE_REMINDER, IN:GET_CONTACT]
reminder	Update event reminder for Sally's anniversary party to next week.	[IN:UPDATE_REMINDER_DATE_TIME]
reminder	Set a reminder to audit reports on the second Thursday of each month	[IN:CREATE_REMINDER, IN:GET_RECURRING_DATE_TIME]
reminder	Move the 3 o'clock reminder to 4	[IN:UPDATE_REMINDER_DATE_TIME]
reminder	When is my next reminder scheduled for?	[IN:GET_REMINDER]
reminder	cancel all my meeting reminders	[IN:DELETE_REMINDER]
reminder	Remove all my reminders for dental appointments	[IN:DELETE_REMINDER]
reminder	read all of the reminders i have set up for this week	[IN:GET_REMINDER]
reminder	how many different breakfast reminders do i have this week?	[IN:GET_REMINDER_AMOUNT]
reminder	Show me my reminder to buy milk for the kids before I go home.	[IN:GET_REMINDER]
reminder	Remind me to order dog food on Friday from Chewy.com before 10:00 am.	[IN:CREATE_REMINDER, IN:GET_TODO]
reminder	Show me all reminders for the week	[IN:GET_REMINDER]
reminder	Move milk reminder from today to tomorrow.	[IN:UPDATE_REMINDER_DATE_TIME]
reminder	Remind me to put Kersal on every night before bed for the next two weeks	[IN:CREATE_REMINDER, IN:GET_TODO, IN:GET_RECURRING_DATE_TIME]
reminder	Set a reminder for my meeting with Milania tomorrow	[IN:CREATE_REMINDER, IN:GET_TODO]
reminder	change location reminder for senior ball	[IN:UPDATE_REMINDER]
reminder	Change Wednesday lunch meeting reminder to 12:00pm	[IN:UPDATE_REMINDER_DATE_TIME]
reminder	set a reminder every Saturday for the month of November to recycle copper	[IN:CREATE_REMINDER, IN:GET_RECURRING_DATE_TIME]
reminder	Switch the cat's vet appointment reminder from Monday to Wednesday.	[IN:UPDATE_REMINDER_DATE_TIME]
reminder	show me my reminder please	[IN:GET_REMINDER]
reminder	Change the reminder about meeting the college alumni for lunch today to tomorrow.	[IN:UPDATE_REMINDER_DATE_TIME]
reminder	Set up a reminder for Kim to submit forms by the tenth each month.	[IN:CREATE_REMINDER, IN:GET_RECURRING_DATE_TIME]
reminder	Remind me about my reminders every 5 hours	[IN:CREATE_REMINDER, IN:GET_RECURRING_DATE_TIME]
reminder	remind me to email marc the details for the camping trip	[IN:CREATE_REMINDER, IN:SEND_MESSAGE]
reminder	cancel all appointment reminders for today.	[IN:DELETE_REMINDER]
reminder	Change the reminder for me to change filters to monthly on the first.	[IN:UPDATE_REMINDER, IN:GET_RECURRING_DATE_TIME]
reminder	Show me all the reminders for Taylor this week.	[IN:GET_REMINDER]
reminder	My daily reminder to take vitamins, please delete.	[IN:DELETE_REMINDER, IN:GET_RECURRING_DATE_TIME]
reminder	whats my last reminder.	[IN:GET_REMINDER]
reminder	set reminder for july 4th party	[IN:CREATE_REMINDER, IN:GET_TODO]
reminder	Reminder for a water filter change every 6 month	[IN:CREATE_REMINDER, IN:GET_RECURRING_DATE_TIME]
reminder	show me my reminders for next tuesday	[IN:GET_REMINDER]
reminder	Reminder to walk the dog every morning before work.	[IN:CREATE_REMINDER, IN:GET_TODO, IN:GET_RECURRING_DATE_TIME]
reminder	Remind Dad, Uncle Charles, Uncle Jimmy, Jason and myself on Friday night to pack for our fishing trip on Saturday morning.	[IN:CREATE_REMINDER, IN:GET_CONTACT, IN:GET_CONTACT, IN:GET_CONTACT, IN:GET_TODO]
reminder	When is my reminder for the school field trip?	[IN:GET_REMINDER_DATE_TIME]
reminder	create reminder to work out each morning	[IN:CREATE_REMINDER, IN:GET_RECURRING_DATE_TIME]
reminder	When is my reminder to pay the kids' school lunch	[IN:GET_REMINDER_DATE_TIME]
reminder	Update reminder to send package from today at 2 pm to Friday at 4 pm	[IN:UPDATE_REMINDER_DATE_TIME]
reminder	Reminders for Tina and Cord's reunion weekend please	[IN:GET_REMINDER, IN:GET_TODO]
reminder	What time am I supposed to remind my husband to leave for his work?	[IN:GET_REMINDER_DATE_TIME]
reminder	Set monthly reminders for me that i have to check my bank account	[IN:CREATE_REMINDER, IN:GET_RECURRING_DATE_TIME]
reminder	Please remind me of the board meeting tonight 1 hour beforehand.	[IN:CREATE_REMINDER, IN:GET_TODO]
reminder	My high school reunion is six months from today, please set a reminder for 1 month ahead.	[IN:CREATE_REMINDER, IN:GET_TODO]
reminder	update the uniform pickup date reminder to next Friday	[IN:UPDATE_REMINDER_DATE_TIME]
reminder	Can you please search all my reminders for doing laundry last week	[IN:GET_REMINDER]
reminder	reminder sat at 8am to drop off flyers for the youth yard sale next week	[IN:CREATE_REMINDER, IN:GET_TODO]
reminder	display all reminders from today	[IN:GET_REMINDER]
reminder	All reminders i had made last year about my tax return	[IN:GET_REMINDER]
reminder	Update today's chores reminders to add kitchen duties.	[IN:UPDATE_REMINDER_TODO]
reminder	move my reminder for celeste and mikes anniversary party to saturday	[IN:UPDATE_REMINDER_DATE_TIME]
reminder	alert me 15 days before taxes are due on april 15	[IN:CREATE_REMINDER, IN:GET_TODO]
reminder	I need to remember to tell the group when they leave on Friday morning to take a big zipper bag with them	[IN:CREATE_REMINDER, IN:GET_TODO]
reminder	Retrieve family birthday party reminders for the entire year.	[IN:GET_REMINDER]
reminder	Set a reminder to visit my sister tonight after the meeting.	[IN:CREATE_REMINDER, IN:GET_TODO]
reminder	Change the location from today to tomorrow on Jim reminder	[IN:UPDATE_REMINDER_DATE_TIME]
reminder	Set reminder to take out the trash at 6pm every day.	[IN:CREATE_REMINDER, IN:GET_RECURRING_DATE_TIME]
reminder	Remind me to reply to Amy that we will be able to attend the surprise party for Lori.	[IN:CREATE_REMINDER, IN:REPLY_MESSAGE]
reminder	Show me reminders about Jack	[IN:GET_REMINDER]
reminder	Set up a reminder to email the class parents about the supplies that will be needed this school year.	[IN:CREATE_REMINDER, IN:SEND_MESSAGE]
reminder	Can you remind me to text Robin the app I used.	[IN:CREATE_REMINDER, IN:SEND_MESSAGE]
reminder	Remind me to defrag my computer every Tuesday at 10PM.	[IN:CREATE_REMINDER, IN:GET_RECURRING_DATE_TIME]
reminder	can you remind my sisters about uncle jacks camping event next weekend instead of this weekend	[IN:UPDATE_REMINDER_DATE_TIME, IN:GET_CONTACT]
reminder	add dishes to my cleaning reminder	[IN:UPDATE_REMINDER_TODO]
reminder	Set monthly reminder to pay water	[IN:CREATE_REMINDER, IN:GET_RECURRING_DATE_TIME]
reminder	I need to buy Aden a birthday present by Friday, 8/1. Please remind me on Wednesday, 7/30.	[IN:CREATE_REMINDER, IN:GET_TODO]
reminder	Set up a reminder to message the party planner tonight.	[IN:CREATE_REMINDER, IN:SEND_MESSAGE]
reminder	When is my reminder to send the samples to Joseph	[IN:GET_REMINDER_DATE_TIME]
reminder	Set a reminder for 6 PM every Sunday to make the kids lunch for the next day.	[IN:CREATE_REMINDER, IN:GET_RECURRING_DATE_TIME, IN:GET_TODO]
reminder	Set reminder alarm every 5 minutes for 1 hour	[IN:CREATE_REMINDER, IN:GET_RECURRING_DATE_TIME]
reminder	show my reminder for tomorrow	[IN:GET_REMINDER]
reminder	Add the list of diet food in all the reminders about grocery shopping	[IN:UPDATE_REMINDER_TODO]
reminder	Change my reminder to 20 minutes earlier.	[IN:UPDATE_REMINDER_DATE_TIME]
reminder	I need to text Nicquana tonight at 7pm. Can you remind me?	[IN:CREATE_REMINDER, IN:GET_TODO, IN:SEND_MESSAGE]
reminder	Remove all reminders about work	[IN:DELETE_REMINDER]
reminder	remind me to cancel with annette for saturday	[IN:CREATE_REMINDER, IN:GET_TODO]
reminder	Please search for all reminders about the dog's vet visits this year	[IN:GET_REMINDER]
reminder	move the reminder for milk up 10 minutes	[IN:UPDATE_REMINDER_DATE_TIME]
reminder	Please delete all swimming lesson reminders.	[IN:DELETE_REMINDER]
reminder	Change the weekly grocery reminder next week to Saturday morning instead of Friday	[IN:UPDATE_REMINDER_DATE_TIME, IN:GET_RECURRING_DATE_TIME]
reminder	change taco tuesday reminder form 12:00 to 16:00	[IN:UPDATE_REMINDER_DATE_TIME]
reminder	Change my reminder for tomorrow.	[IN:UPDATE_REMINDER]
reminder	Please change the alert time from 7 to 9 for my nail appointment	[IN:UPDATE_REMINDER_DATE_TIME]
reminder	I dont want to miss the online chat at 10 pm , can you remind me at 3 pm .	[IN:CREATE_REMINDER, IN:GET_TODO]
reminder	Remind me to text James that I can meet him for brunch on Sunday at 11am	[IN:CREATE_REMINDER, IN:SEND_MESSAGE]
reminder	is the alert time for brunch on sunday set for an hour before?	[IN:GET_REMINDER_DATE_TIME, IN:GET_TODO]
reminder	set a daily wake-up reminder for 6:45 am.	[IN:CREATE_REMINDER, IN:GET_RECURRING_DATE_TIME]
reminder	Set up a reminder for the Little Miss Benson pageant on Sept 7 for a week ahead of time.	[IN:CREATE_REMINDER, IN:GET_TODO]
reminder	Delete my dinner reminder and reschedule it for next saturday	[IN:UPDATE_REMINDER_DATE_TIME]
reminder	When is my next reminder?	[IN:GET_REMINDER_DATE_TIME]
reminder	delete all reminders for the next week for now	[IN:DELETE_REMINDER]
reminder	Remind me to go visit my grandmother once a month	[IN:CREATE_REMINDER, IN:GET_RECURRING_DATE_TIME]
reminder	remind me to fast on aug-20 the night for my blood test	[IN:CREATE_REMINDER, IN:GET_TODO]
reminder	Add a reminder to Friday's group meeting asking me to remove Peter from the group.	[IN:CREATE_REMINDER, IN:GET_TODO]
reminder	What's my next reminder this morning, and is it for my workout class?	[IN:GET_REMINDER]
reminder	change reminder to meet cpa and sign tax papers to thur instead of fri	[IN:UPDATE_REMINDER_DATE_TIME]
reminder	Please cancel all of my reminders for the month of August.	[IN:DELETE_REMINDER]
reminder	Can you remind me to dial in half an hour before today's conference call?	[IN:CREATE_REMINDER, IN:GET_TODO]
reminder	I want you to set up a daily reminder to remind me to practice my music lessons.	[IN:CREATE_REMINDER, IN:GET_RECURRING_DATE_TIME]
reminder	Create a change to my weekly dance class reminder, to Tuesdays instead of Wednesdays.	[IN:UPDATE_REMINDER, IN:GET_RECURRING_DATE_TIME, IN:GET_RECURRING_DATE_TIME, IN:GET_RECURRING_DATE_TIME]
reminder	The time for my reminder on Saturday needs to be changed to 4pm.	[IN:UPDATE_REMINDER_DATE_TIME]
reminder	modify the reminder for the bowling league to include the dinner before we begin to bowl	[IN:UPDATE_REMINDER_TODO]
